{
  "schema_version": 1,
  "tasks": [
    {
      "schema_version": 1,
      "id": "task-018f8dab",
      "agent_id": "agent-01",
      "type": "shell",
      "arguments": {
        "command": "whoami"
      },
      "timeout_seconds": 30,
      "status": "completed",
      "created_at": "2026-07-23T16:30:00Z",
      "queued_at": "2026-07-23T16:30:00Z",
      "dispatched_at": "2026-07-23T16:30:01Z",
      "started_at": "2026-07-23T16:30:05Z",
      "completed_at": "2026-07-23T16:30:06Z",
      "expires_at": "2026-07-23T16:35:00Z",
      "result": {
        "schema_version": 1,
        "task_id": "task-018f8dab",
        "agent_id": "agent-01",
        "outcome": "completed",
        "started_at": "2026-07-23T16:30:05Z",
        "completed_at": "2026-07-23T16:30:06Z",
        "exit_code": 0
      }
    }
  ],
  "limit": 50,
  "offset": 0,
  "total": 1,
  "next_offset": null
}
